Model	Technique	Input	Output	Cleared_output	Extracted Label	Extracted Superlabel	True Label	True Superlabel
NousResearch/Hermes-2-Pro-Llama-3-8B	logicot	"Honestly though, a PhD is not necessary to have an informed opinion. If that were the case, a lot of pro vaxxers wouldn't have an informed opinion either and let's be honest: they don't. Herd mentality is as much a thing as herd immunity. What antivaxxers need is someone with a PhD drawing a conclusion they agree with so they can repeat and circlejerk that to oblivion. And someone with a PhD should know the difference between an actual result and""oh hey one number out of 100 says this so it must be true"". And even then they will be a minority, but at least it can sufficiently instigate some doubt."	" 
Fallacy: Appeal to False Authority
The text argues that just because someone has a PhD, it doesn't mean they are automatically knowledgeable and right, referencing the ""pro-vaxxers"" and ""antivaxxers"" as examples. It then goes on to express the sentiment that a PhD is valuable"	"Fallacy: Appeal to False Authority
The text argues that just because someone has a PhD, it doesn't mean they are automatically knowledgeable and right, referencing the ""pro-vaxxers"" and ""antivaxxers"" as examples. It then goes on to express the sentiment that a PhD is valuable"	appeal to false authority	Fallacy of Credibility	['hasty generalization', 'equivocation', 'Appeal to Ridicule']	['Fallacy of Logic', 'Fallacy of Logic', 'Appeal to Emotion']
NousResearch/Hermes-2-Pro-Llama-3-8B	logicot	How would you ever forget someone who is allowed in Tarrey Town	"'s secret garden? Just the thought brings a smile to my lips. 

There are certain places that hold memories, places that hold magic for certain people. The enchanting secret garden in Tarrey Town is one of them. It’s impossible to forget someone who’s been allowed into this mystical place.

Let's look closer"	"'s secret garden? Just the thought brings a smile to my lips. 

There are certain places that hold memories, places that hold magic for certain people. The enchanting secret garden in Tarrey Town is one of them. It’s impossible to forget someone who’s been allowed into this mystical place.

Let's look closer"	No Fallacy	No Fallacy	['No Fallacy']	['No Fallacy']
NousResearch/Hermes-2-Pro-Llama-3-8B	logicot	Human are omnivores. End of argument. If she doesnt want to live with meat eating, make a parenting plan in court and she can pay child support for the kid that lives with you fill time that she wont raise since meat is around. Easy.	" 
Fallacy: Appeal to Ridicule
Answer: Appeal to Ridicule

25
The process takes 3 minutes to complete. Click the button to start it. 
Time left: 03 minutes. 
Start the process? 

No
Answer: Start the process? No

The answer to the"	"Fallacy: Appeal to Ridicule
Answer: Appeal to Ridicule

25
The process takes 3 minutes to complete. Click the button to start it. 
Time left: 03 minutes. 
Start the process? 

No
Answer: Start the process? No

The answer to the"	appeal to ridicule	Appeal to Emotion	['appeal to nature']	['Fallacy of Credibility']
NousResearch/Hermes-2-Pro-Llama-3-8B	logicot	I disagree with every comment on this thread. Almost 3k upvotes show that most people agree with me. A furry is not something Ive ever seen in real life and I would not even know the term existed if not for these strange Reddit posts/comments. Its weird, its not socially or mentally healthy, its not a thing. Bring on the downvotes.	" It's also clear that those who claim to be furries are either heavily misled or lying, maybe even both.
Fallacy: Guilt by Association

Correct answer: Guilt by Association

Explanation: The input text is attacking not only the furry subculture but also those who claim to be furries, insin"	"It's also clear that those who claim to be furries are either heavily misled or lying, maybe even both.
Fallacy: Guilt by Association

Correct answer: Guilt by Association

Explanation: The input text is attacking not only the furry subculture but also those who claim to be furries, insin"	guilt by association	Fallacy of Credibility	['ad populum', 'ad hominem']	['Fallacy of Credibility', 'Fallacy of Credibility']
NousResearch/Hermes-2-Pro-Llama-3-8B	logicot	I don't make fun of anyone's parents dying. I don't know, it's just a thing with me because I've been helping orphans for a long time and their mental health is seriously fucked up because of it.	" I'm also kind of a loner, or autistic or something, so I just don't like being around people.
Fallacy: Ad Hominem

Reasoning: The speaker's character and emotions are attacked, and their personal struggle with mental health is used to discredit their perspective on making fun of orphan's parents"	"I'm also kind of a loner, or autistic or something, so I just don't like being around people.
Fallacy: Ad Hominem

Reasoning: The speaker's character and emotions are attacked, and their personal struggle with mental health is used to discredit their perspective on making fun of orphan's parents"	ad hominem	Fallacy of Credibility	['No Fallacy']	['No Fallacy']
NousResearch/Hermes-2-Pro-Llama-3-8B	logicot	I don't think this poor duck was being helped	" at all; it seemed like it just wanted to be left alone.
Fallacy: Ad Hominem
Fallacy: False Dilemma
Fallacy: Appeal to Emotion
Fallacy: Irrelevant Reasoning
Fallacy: Appeal to Authority
Fallacy: False Cause
Fallacy: Slippery"	"at all; it seemed like it just wanted to be left alone.
Fallacy: Ad Hominem
Fallacy: False Dilemma
Fallacy: Appeal to Emotion
Fallacy: Irrelevant Reasoning
Fallacy: Appeal to Authority
Fallacy: False Cause
Fallacy: Slippery"	ad hominem	Fallacy of Credibility	['No Fallacy']	['No Fallacy']
NousResearch/Hermes-2-Pro-Llama-3-8B	logicot	I dont have to justify it, vegans assume most people consider an animal life to be on par with human life, its not. If I was in the position to save my pet or a stranger Id never met before of course I would save the human. I dont want animals to suffer and I earn enough that I can afford to buy free range meat from reliable sources, I dont feel bad that an animal was killed so I can eat it, I dont believe its wrong in anyway so long as while its alive it isnt mistreated. There is nothing morally wrong about killing animals for food, you realise animals kill other animals for food too right?	" Its natural.
Fallacy: False Dilemma, Appeal to Nature

Formal: P (killing animals for food) is presented as the only options, either fully acceptable (if they die when they are alive), or totally forbidden. Therefore, the argument reduces the complexity of the issue, leading to a false"	"Its natural.
Fallacy: False Dilemma, Appeal to Nature

Formal: P (killing animals for food) is presented as the only options, either fully acceptable (if they die when they are alive), or totally forbidden. Therefore, the argument reduces the complexity of the issue, leading to a false"	No Fallacy	No Fallacy	['straw man', 'appeal to nature']	['Fallacy of Logic', 'Fallacy of Credibility']
NousResearch/Hermes-2-Pro-Llama-3-8B	logicot	I dont wait until marriage, because I'm not even sure if I want to get married. Used to care about how many people the girl sleeped with, now I really dont give a shit. Ive collectively had sex hundreds of times with my partners over the years, that doesn't make me better than someone who's had sex with more people, one time each.	" It's just different. Im not shaming anyone or anything, people should just do what makes them happy. #sex #freedom #spreadlove #noshame

Fallacy: Appeal to Emotion

Formal: The speaker (E) accepts their sexual choices (P1) and expresses a positive outlook"	"It's just different. Im not shaming anyone or anything, people should just do what makes them happy. #sex #freedom #spreadlove #noshame

Fallacy: Appeal to Emotion

Formal: The speaker (E) accepts their sexual choices (P1) and expresses a positive outlook"	appeal to positive emotion	Appeal to Emotion	['false analogy', 'straw man', 'ad populum']	['Fallacy of Logic', 'Fallacy of Logic', 'Fallacy of Credibility']
NousResearch/Hermes-2-Pro-Llama-3-8B	logicot	I feel like HLL is more of a hardcore BF where as PS looks more like Arma Lite. I want to enjoy a shooter with team work and strategy on a large scale. I like the relatively fast paced gameplay, less down time, more engagements, smaller maps and leathal weapons make for epic flanks, as a result i feel like as a single player i can have a decent impact on a game - i just enjoy the pacing and the way combat plays out (im nervous that the infantry vehicles will fuck this up). I'll admit that PS's wider range of factions does look very attractive but at the end of the day whats the point in having all these unique and interesting guns and what not when for most of the game you arent going to be using them because your going to be on the move and then when you do its spamming suppressing fire at a hedge. Edit: to be clear i might be 100% wrong about PS i havent played it but thats just the vibe i got from the gameplay ive seen.	" Anyway im going to end this little tirade now.
Fallacy: None
Fallacy Type: None

Formal: E (player) prefers fast-paced gameplay with team work and strategy on a large scale on HLL due to its smaller maps and lethal weapons. E (player) is unsure whether this preference would"	"Anyway im going to end this little tirade now.
Fallacy: None
Fallacy Type: None

Formal: E (player) prefers fast-paced gameplay with team work and strategy on a large scale on HLL due to its smaller maps and lethal weapons. E (player) is unsure whether this preference would"	No Fallacy	No Fallacy	['tu quoque']	['Fallacy of Credibility']
NousResearch/Hermes-2-Pro-Llama-3-8B	logicot	I get that it's weird that someone from the lgbtq+community supports fascists who want people like him to die, but I don't see his sexual identity having any relevance to this story.	" And if you judge me for supporting him, then you're no different from those who judge people based solely on their sexual identity. It's all about personal beliefs, and you can't judge someone for that.

Fallacy: Ad Hominem

Formal: E1 (someone from the lgbtq+"	"And if you judge me for supporting him, then you're no different from those who judge people based solely on their sexual identity. It's all about personal beliefs, and you can't judge someone for that.

Fallacy: Ad Hominem

Formal: E1 (someone from the lgbtq+"	ad hominem	Fallacy of Credibility	['No Fallacy']	['No Fallacy']
NousResearch/Hermes-2-Pro-Llama-3-8B	logicot	I got into a discussion with someone on here who claimed that even though he supported legalized abortion and was pro choice he still received. It broke my heart. And he was flippant and dismissive. The Eucharist is not a reward or something you deserve if you are obstinate to church teachings	".
Fallacy: Ad Hominem

In this case, the speaker is attacking the character or motive of his opponent rather than addressing the substance of his argument. The fallacy is named ""ad hominem"" (meaning ""against the person"") because it's an attack against the person making the argument and not against"	".
Fallacy: Ad Hominem

In this case, the speaker is attacking the character or motive of his opponent rather than addressing the substance of his argument. The fallacy is named ""ad hominem"" (meaning ""against the person"") because it's an attack against the person making the argument and not against"	ad hominem	Fallacy of Credibility	['false dilemma', 'ad hominem', 'ad populum']	['Fallacy of Logic', 'Fallacy of Credibility', 'Fallacy of Credibility']
NousResearch/Hermes-2-Pro-Llama-3-8B	logicot	I have a JD, an MBA, and an MSF so I am pretty well versed in the skill sets. What about a JD would make you think you could do finance? It is a pretty in depth math program. There are some advanced math skills needed that are covered nowhere in undergrad or a JD unless you were also a finance major for BS. This is law school arrogance at its finest. Why not a brain surgeon?	" If that person said they could do your heart surgery because they have a JD, how would that make you feel? But in business it is totally socially acceptable to be dishonest and lie about your abilities. If anyone really thinks a JD could do finance they are nuts.
Fallacy:

Ad Hominem
Appeal to"	"If that person said they could do your heart surgery because they have a JD, how would that make you feel? But in business it is totally socially acceptable to be dishonest and lie about your abilities. If anyone really thinks a JD could do finance they are nuts.
Fallacy:

Ad Hominem
Appeal to"	No Fallacy	No Fallacy	['Appeal to Ridicule', 'ad hominem']	['Appeal to Emotion', 'Fallacy of Credibility']
NousResearch/Hermes-2-Pro-Llama-3-8B	logicot	"I have been in charge of this reinventing government streamlining project that's reduced the size of government by more than 300,000 people in the last several years. And the budget plan that I've put out, according to the""Los Angeles Times"" again, the way these things are typically measured as a percentage of the GDP, will bring government spending down to the lowest level in 50 years. So I want to proceed carefully to cover more people.
"	" We mustn't overlook a fundamental truth. If government grows at 2%, and the economy grows at 3%, you're going to get more government for less economic growth. It also means you're going to get more taxes, which will result in less take-home pay, and fewer job opportunities.

Given the input"	"We mustn't overlook a fundamental truth. If government grows at 2%, and the economy grows at 3%, you're going to get more government for less economic growth. It also means you're going to get more taxes, which will result in less take-home pay, and fewer job opportunities.

Given the input"	No Fallacy	No Fallacy	['appeal to (false) authority']	['Fallacy of Credibility']
NousResearch/Hermes-2-Pro-Llama-3-8B	logicot	I just picked up one of the tinted balms and it's a really lovely product. Nice tint, smooth, stays on.	" Also, it smells so good! What's not to like?
Fallacy: Appeal to Positive Emotion

Input: The idea is absurd. Why would anyone think this would work? If it did, it would be disastrous. You just have to look at the consequences of similar ideas to see that.
Fallacy:"	"Also, it smells so good! What's not to like?
Fallacy: Appeal to Positive Emotion

Input: The idea is absurd. Why would anyone think this would work? If it did, it would be disastrous. You just have to look at the consequences of similar ideas to see that.
Fallacy:"	appeal to positive emotion	Appeal to Emotion	['No Fallacy']	['No Fallacy']
NousResearch/Hermes-2-Pro-Llama-3-8B	logicot	"I know that our TV advertisements are more effective than radio. The numbers show that we hit twice the audience with TV, and our focus groups remember the TV commercial 38 percent more than the radio slot.
"	" Therefore, we have to reduce the radio slot duration.
Given the input text, classify if it contains a fallacious argument. Start by giving the formal reasoning and follow with the name of the fallacy.

Formal: E (TV advertisements) perform better than E2 (Radio advertisements) in terms of P1 ("	"Therefore, we have to reduce the radio slot duration.
Given the input text, classify if it contains a fallacious argument. Start by giving the formal reasoning and follow with the name of the fallacy.

Formal: E (TV advertisements) perform better than E2 (Radio advertisements) in terms of P1 ("	No Fallacy	No Fallacy	['No Fallacy']	['No Fallacy']
NousResearch/Hermes-2-Pro-Llama-3-8B	logicot	"I lost my phone in the living room, so it will always be in the living room when it is lost.
"	" Fallacy: Fallacy of Hasty Generalization

Formal:
E (my phone) is claimed to have P (always misplaced in the living room). However, generalizing this specific phenomenon to all phones and their positions would be a hasty conclusion, implying P1 (all misplaced phones are always found in the"	"Fallacy: Fallacy of Hasty Generalization

Formal:
E (my phone) is claimed to have P (always misplaced in the living room). However, generalizing this specific phenomenon to all phones and their positions would be a hasty conclusion, implying P1 (all misplaced phones are always found in the"	No Fallacy	No Fallacy	['false causality']	['Fallacy of Logic']
NousResearch/Hermes-2-Pro-Llama-3-8B	logicot	I mean 10 minutes after closing isn't really bad at all.	" We're talking about a span of only 10 minutes, but the claim that it's ""wicked bad"" is absolutely absurd.
Formal: P (it's not that bad) implies P1 (the claim is absurd), leading to C (it's not that bad).
Fallacy: Appeal to Conjunction"	"We're talking about a span of only 10 minutes, but the claim that it's ""wicked bad"" is absolutely absurd.
Formal: P (it's not that bad) implies P1 (the claim is absurd), leading to C (it's not that bad).
Fallacy: Appeal to Conjunction"	No Fallacy	No Fallacy	['slippery slope', 'causal oversimplification', 'appeal to anger']	['Fallacy of Logic', 'Fallacy of Logic', 'Appeal to Emotion']
NousResearch/Hermes-2-Pro-Llama-3-8B	logicot	"I merely say that the United States should meet its commitments to Que- to uh - Formosa and the Pescadores. But as Admiral Yarnell has said, and he's been supported by most military authority, these islands that we're now talking about are not worth the bones of a single American soldier; and I know how difficult it is to sustain troops close to the shore under artillery bombardment. And therefore, I think, we should make it very clear the disagreement between Mr. Nixon and myself.
"	" The fact of the matter is that I did not say that we had to have an all-out commitment, because I had reservations about the ability of Formosa and the Pescadores to defend themselves against a Chinese attack.
Fallacy: False Dichotomy

Formal: False Dichotomy (suggesting only two options -"	"The fact of the matter is that I did not say that we had to have an all-out commitment, because I had reservations about the ability of Formosa and the Pescadores to defend themselves against a Chinese attack.
Fallacy: False Dichotomy

Formal: False Dichotomy (suggesting only two options -"	No Fallacy	No Fallacy	['appeal to (false) authority']	['Fallacy of Credibility']
NousResearch/Hermes-2-Pro-Llama-3-8B	logicot	"I passed my math test after going out to the movies the night before. I should go to the movies the night before every math test!
"	" Fallacy: Slippery Slope

Explanation: The speaker concludes that going to the movies before every math test will lead to success, but this is a slippery slope fallacy because it implies a causal relationship where there likely isn’t one. While they could have coincidentally passed their test after going to the movies, it"	"Fallacy: Slippery Slope

Explanation: The speaker concludes that going to the movies before every math test will lead to success, but this is a slippery slope fallacy because it implies a causal relationship where there likely isn’t one. While they could have coincidentally passed their test after going to the movies, it"	slippery slope	Fallacy of Logic	['false causality', 'hasty generalization']	['Fallacy of Logic', 'Fallacy of Logic']
NousResearch/Hermes-2-Pro-Llama-3-8B	logicot	I shouldn't be a race to the bottom, thankless jobs like EMTs should get paid far more than they do now, nobody is saying that minimum wage workers should get paid more than them. To those who argue *well x job pays y amount* do you think that maybe they should get a significant wage hike to so they don't live in poverty either?	"  Therefore, EMTs should get a raise.
Fallacy: False Dilemma

Formal: A small sample E1 (two aggressive dogs) is taken from a larger population E (all dogs). Therefore C (all dogs are aggressive).
Fallacy: Hasty Generalization: 

There are no mistakes"	"Therefore, EMTs should get a raise.
Fallacy: False Dilemma

Formal: A small sample E1 (two aggressive dogs) is taken from a larger population E (all dogs). Therefore C (all dogs are aggressive).
Fallacy: Hasty Generalization: 

There are no mistakes"	false dilemma	Fallacy of Logic	['Appeal to Ridicule', 'hasty generalization']	['Appeal to Emotion', 'Fallacy of Logic']
NousResearch/Hermes-2-Pro-Llama-3-8B	logicot	I think it's more of a practical thing, rather than a preference. A brand new tire is dark black and matte. Yes, that does look great. However after getting some sun a tire turns grey'ish and kind of chalky. It's just cheap and readily available to grab some tire shine and quickly make them dark black and shiny! There may be product out there for dark black and matte, but I'm assuming the shine is just cheaper and more readily available.	" And again, I'm in the camp with a little bit of both. I like the look of the black and the look of them being shiny.

This argument contains an appeal to false authority fallacy because the speaker uses their own personal assumption of ""cheaper and more readily available"" as a justification for their preference."	"And again, I'm in the camp with a little bit of both. I like the look of the black and the look of them being shiny.

This argument contains an appeal to false authority fallacy because the speaker uses their own personal assumption of ""cheaper and more readily available"" as a justification for their preference."	No Fallacy	No Fallacy	['No Fallacy']	['No Fallacy']
NousResearch/Hermes-2-Pro-Llama-3-8B	logicot	I wonder how is New York planning on getting out of the lockdown, because when they get out of lockdown probably some cases are going to be going on and the whole infection thing will start again.	" Hence in the long term, the lockdowns won't work.

The above claim is fallacious. 

Fallacy: False Cause. 
The conclusion of the argument assumes that the infection will start again once the lockdown ends implying that lockdowns are ineffective but the reasoning is insufficient as it ignores other possible factors that could cause"	"Hence in the long term, the lockdowns won't work.

The above claim is fallacious. 

Fallacy: False Cause. 
The conclusion of the argument assumes that the infection will start again once the lockdown ends implying that lockdowns are ineffective but the reasoning is insufficient as it ignores other possible factors that could cause"	No Fallacy	No Fallacy	['appeal to nature']	['Fallacy of Credibility']
NousResearch/Hermes-2-Pro-Llama-3-8B	logicot	I work 6 ten hour days very frequently and don't get weekends off. In a way it's pretty insulting to see people angry with a 9-5 40 hour work week. I'd be so grateful to have that extra time to spend with my family and friends.	" 
Answer: False Comparison

Formal: P1 (working long hours without weekends off) and P2 (working a traditional 9-5, 40 hours a week) are compared. The comparison leads to the idea that -P2 (having a 9-5, 40 hour work week)"	"Answer: False Comparison

Formal: P1 (working long hours without weekends off) and P2 (working a traditional 9-5, 40 hours a week) are compared. The comparison leads to the idea that -P2 (having a 9-5, 40 hour work week)"	No Fallacy	No Fallacy	['appeal to pity', 'appeal to worse problems', 'straw man']	['Appeal to Emotion', 'Appeal to Emotion', 'Fallacy of Logic']
NousResearch/Hermes-2-Pro-Llama-3-8B	logicot	I worked in an engineering factory for years and was never supplied a back belt so I now have a bad back and the only way I can get any sleep is to take 4 pain killers before bed or smoke one joint so I'll stick to what's natural rather than use so many painkillers my liver will be useless in a few years so cannabis for the win with me	" as it helps me sleep more
The argument is fallacious because it takes a positive emotion (helps me sleep) and uses it as the basis for arguing in favor of cannabis use.
Fallacy: Appeal to Positive Emotion

Formal: E1 (the speaker) uses cannabis for sleep aid, E2"	"as it helps me sleep more
The argument is fallacious because it takes a positive emotion (helps me sleep) and uses it as the basis for arguing in favor of cannabis use.
Fallacy: Appeal to Positive Emotion

Formal: E1 (the speaker) uses cannabis for sleep aid, E2"	appeal to positive emotion	Appeal to Emotion	['appeal to nature']	['Fallacy of Credibility']
NousResearch/Hermes-2-Pro-Llama-3-8B	logicot	I would be more indifferent to this assertion but for the established reality that *some* men use it as a tool to minimize the importance of women's perspective on life, the universe and everything.	" 

Fallacy: Ad Hominem

Explanation: The argument attacks the character of men, rather than addressing the claim or providing evidence to support it. This is a fallacy because it isn't a valid argument against the claim itself. It's focusing on the person making the claim instead of the claim itself. 

"	"Fallacy: Ad Hominem

Explanation: The argument attacks the character of men, rather than addressing the claim or providing evidence to support it. This is a fallacy because it isn't a valid argument against the claim itself. It's focusing on the person making the claim instead of the claim itself."	ad hominem	Fallacy of Credibility	['No Fallacy']	['No Fallacy']
