Model	Technique	Input	Output	Cleared_output	Extracted Label	Extracted Superlabel	True Label	True Superlabel
NousResearch/Hermes-2-Pro-Llama-3-8B	logicot	"Let us move now to the future. It is not enough to stand on this record because we are dealing with the most ruthless, fanatical... leaders that the world has ever seen. That is why I say that in this period of the sixties, America must move forward in every area.
"	 What we are dealing with is evil, and we must take care not to confuse our sense of good and evil in looking at it. And there are those who would seek to divide us, but we must make our decision on the truth of a matter. They tell us we must learn to live with this evil. They	What we are dealing with is evil, and we must take care not to confuse our sense of good and evil in looking at it. And there are those who would seek to divide us, but we must make our decision on the truth of a matter. They tell us we must learn to live with this evil. They	No Fallacy	No Fallacy	['appeal to fear', 'causal oversimplification']	['Appeal to Emotion', 'Fallacy of Logic']
NousResearch/Hermes-2-Pro-Llama-3-8B	logicot	"Lola: I don't think John would be a good fit to manage this project, because he doesn't have a lot of experience with project management. John: But you don't have a lot of experience in project management either!
"	" Therefore, you shouldn't be managing it yourself.

Fallacy: Appeal to False Analogy
Formal: John's experience or lack thereof is compared to Lola's experience or lack thereof. But these two cases are not similar or comparable, as John's lack of experience is not an argument in favor, but against him"	"Therefore, you shouldn't be managing it yourself.

Fallacy: Appeal to False Analogy
Formal: John's experience or lack thereof is compared to Lola's experience or lack thereof. But these two cases are not similar or comparable, as John's lack of experience is not an argument in favor, but against him"	appeal to false authority	Fallacy of Credibility	['tu quoque']	['Fallacy of Credibility']
NousResearch/Hermes-2-Pro-Llama-3-8B	logicot	Loooool. Their immunity is so op. I thought this was going to be a warlord war trolls run or something from the title	", but it was more like a warlord war trolls walk. lol.
 
Fallacy: No fallacy.
 1. Hasty Generalization
 2. Slippery Slope
 3. Ad Hominem 
 4. Ad Populum 
 5. Appeal to False Authority 
 6"	", but it was more like a warlord war trolls walk. lol.
 
Fallacy: No fallacy.
 1. Hasty Generalization
 2. Slippery Slope
 3. Ad Hominem 
 4. Ad Populum 
 5. Appeal to False Authority 
 6"	No Fallacy	No Fallacy	['No Fallacy']	['No Fallacy']
NousResearch/Hermes-2-Pro-Llama-3-8B	logicot	"MARVIN STONE: You suggest that we scrap the SALT II treaty already negotiated, and intensify the build-up of American power to induce the Soviets to sign a new treaty - one more favorable to us. President Carter, on the other hand, says he will again try to convince a reluctant Congress to ratify the present treaty on the grounds it's the best we can hope to get. Now, both of you cannot be right. Will you tell us why you think you are? RONALD REAGAN: Yes. I think I'm right because I believe that we must have a consistent foreign policy, a strong America, and a strong economy. And then, as we build up our national security, to restore our margin of safety, we at the same time try to restrain the Soviet build-up, which has been going forward at a rapid pace, and for quite some time. October 28, 1980 Cleveland, Ohio What logical fallacy did Reagan's response illustrate the use of?
"	 Answer: False Dilemma. Reasoning: Reagan's response presents the two sides - scrapping SALT II and trying to convince Congress to ratify it - as exhaustive options. However, no mention of a third option or a combination of both is given, thereby creating a false dilemma.  Formal: E1	Answer: False Dilemma. Reasoning: Reagan's response presents the two sides - scrapping SALT II and trying to convince Congress to ratify it - as exhaustive options. However, no mention of a third option or a combination of both is given, thereby creating a false dilemma.  Formal: E1	No Fallacy	No Fallacy	['appeal to positive emotion']	['Appeal to Emotion']
NousResearch/Hermes-2-Pro-Llama-3-8B	logicot	Max payne had plenty of glitchy craziness, loved it though	", but playing now it's just plain boring.
Fallacy: Slippery Slope
Formal: From enjoying Max Payne's glitches and craziness to finding the game boring now, the conclusion that the game can only be enjoyed with glitches implies a slippery slope fallacy. 

Input: The movie had a lot of"	", but playing now it's just plain boring.
Fallacy: Slippery Slope
Formal: From enjoying Max Payne's glitches and craziness to finding the game boring now, the conclusion that the game can only be enjoyed with glitches implies a slippery slope fallacy. 

Input: The movie had a lot of"	slippery slope	Fallacy of Logic	['No Fallacy']	['No Fallacy']
NousResearch/Hermes-2-Pro-Llama-3-8B	logicot	"Men score better on math than women do. Jerry is a man. Therefore, Jerry is better at math than Sylvia, who is a woman.
"	" This is due to genetics.

Fallacy: This argument is based on Genetic Fallacy. The problem lies in assuming that because the premise of a belief has genetic origins, it must be true or false based on these origins.


In the passage ""I am often asked why I enjoy running so much. My response is that"	"This is due to genetics.

Fallacy: This argument is based on Genetic Fallacy. The problem lies in assuming that because the premise of a belief has genetic origins, it must be true or false based on these origins.


In the passage ""I am often asked why I enjoy running so much. My response is that"	No Fallacy	No Fallacy	['fallacy of division']	['Fallacy of Logic']
NousResearch/Hermes-2-Pro-Llama-3-8B	logicot	"Michael Jackson, Kurt Cobain, and Jimi Hendrix were rock stars who died young. Therefore, if you become a rock star, don't expect to live a long life.
"	" Formal: E1 (Rock stars, specifically those who died young) has a characteristic P (die young). So, E2 (Rock stars in general) also has P.  Fallacy: Hasty Generalization
The answer is: Hasty Generalization

Formal: E1 (Rock stars, specifically"	"Formal: E1 (Rock stars, specifically those who died young) has a characteristic P (die young). So, E2 (Rock stars in general) also has P.  Fallacy: Hasty Generalization
The answer is: Hasty Generalization

Formal: E1 (Rock stars, specifically"	hasty generalization	Fallacy of Logic	['hasty generalization']	['Fallacy of Logic']
NousResearch/Hermes-2-Pro-Llama-3-8B	logicot	Most animals, including humans are meant to consume meat. Humans would've probably died out by eating vegetables alone. So why not doing what we were meant to do by enjoying some salmon? Or do you actually think fish is okay since you don't think they look cute?	" 
Fallacy: Appeal to Nature
$$
\text{Premise 1: Most animals, including humans, are meant to consume meat.}
$$
$$
\text{Premise 2: Humans would've probably died out by eating vegetables alone.}
$$
$$
\text{Premise"	"Fallacy: Appeal to Nature
$$
\text{Premise 1: Most animals, including humans, are meant to consume meat.}
$$
$$
\text{Premise 2: Humans would've probably died out by eating vegetables alone.}
$$
$$
\text{Premise"	appeal to nature	Fallacy of Credibility	['appeal to nature', 'Appeal to Ridicule']	['Fallacy of Credibility', 'Appeal to Emotion']
NousResearch/Hermes-2-Pro-Llama-3-8B	logicot	"Mr. Gough supports the cell phone ban and he's an idiot, so we should let teachers keep their cell phones.
"	" Fallacy: Ad Hominem  Formal: E (Mr. Gough) claims P (supports the cell phone ban). Therefore, the speaker attacks Mr. Gough's character (A), implying -P (does not support the cell phone ban). 

In this case, the fallacy is an Ad H"	"Fallacy: Ad Hominem  Formal: E (Mr. Gough) claims P (supports the cell phone ban). Therefore, the speaker attacks Mr. Gough's character (A), implying -P (does not support the cell phone ban). 

In this case, the fallacy is an Ad H"	ad hominem	Fallacy of Credibility	['ad hominem']	['Fallacy of Credibility']
NousResearch/Hermes-2-Pro-Llama-3-8B	logicot	"Mr. Governor issues a proclamation for the people of his state to pray for rain. Several months later, it rains. Praise the gods!
"	" Do you think the rain came as a result of the proclamation or just coincidental?

The argument is not fallacious.
The reasoning is flawed for the given conclusion but not intentionally misleading. The fact that it rained some months after the proclamation doesn't necessarily imply that it was caused by the proclamation. The rain could just"	"Do you think the rain came as a result of the proclamation or just coincidental?

The argument is not fallacious.
The reasoning is flawed for the given conclusion but not intentionally misleading. The fact that it rained some months after the proclamation doesn't necessarily imply that it was caused by the proclamation. The rain could just"	No Fallacy	No Fallacy	['Appeal to Ridicule', 'false causality']	['Appeal to Emotion', 'Fallacy of Logic']
NousResearch/Hermes-2-Pro-Llama-3-8B	logicot	"Mrs. Miller taught your older brother, who was the class clown. She decides to be strict with you from the very first day of class because she thinks you will be a clown, too.
"	"25 years later, you tell your story to Mrs. Miller who then thanks you for bringing it to her attention. Therefore, Mrs. Miller is a strict teacher.
Fallacy: No fallacy

Formal: P1 (being the class clown) leads to P2 ( Mrs. Miller’s strictness). C"	"25 years later, you tell your story to Mrs. Miller who then thanks you for bringing it to her attention. Therefore, Mrs. Miller is a strict teacher.
Fallacy: No fallacy

Formal: P1 (being the class clown) leads to P2 ( Mrs. Miller’s strictness). C"	No Fallacy	No Fallacy	['guilt by association']	['Fallacy of Credibility']
NousResearch/Hermes-2-Pro-Llama-3-8B	logicot	"Murder is morally wrong. Therefore, abortion is morally wrong.
"	" Fallacy: False Analogy.

Input: Humans contribute to air pollution, therefore, we should reduce our carbon footprint to mitigate the effects of climate change. Fallacy: None. 

Input: Exercise is good for you. Therefore, everyone should exercise. Fallacy: Slippery Slope.

Input: You agree that"	"Fallacy: False Analogy.

Input: Humans contribute to air pollution, therefore, we should reduce our carbon footprint to mitigate the effects of climate change. Fallacy: None. 

Input: Exercise is good for you. Therefore, everyone should exercise. Fallacy: Slippery Slope.

Input: You agree that"	No Fallacy	No Fallacy	['false analogy']	['Fallacy of Logic']
NousResearch/Hermes-2-Pro-Llama-3-8B	logicot	My boss insisted that everybody be at their desks at 8:30 sharp. She made me take roll on an attendance sheet and hand it into her everyday. She also made me do it at lunch time (when everybody left and came back) and when they left at night. Took roll for a bunch of adults three times a day. I don't work there anymore.	" 
The boss was treating the employees like children, micromanaging everything. 

Fallacy: False Analogy
Reasoning: The boss's behavior is being compared to how one would treat children, which is used to criticize her actions, implying that treating adults like children is unreasonable. However, this comparison may not necessarily"	"The boss was treating the employees like children, micromanaging everything. 

Fallacy: False Analogy
Reasoning: The boss's behavior is being compared to how one would treat children, which is used to criticize her actions, implying that treating adults like children is unreasonable. However, this comparison may not necessarily"	false analogy	Fallacy of Logic	['No Fallacy']	['No Fallacy']
NousResearch/Hermes-2-Pro-Llama-3-8B	logicot	"My first day of basketball practice was easy, so it will always be easy.
"	" Therefore, it must be included in the team.
Fallacy: Hasty Generalization.  The conclusion that it will ""always"" be easy mistakes one day's performance for the future. Also, it appeals to positive emotion, as it might imply that the candidate will surely make the team. 

Correct answer:
Fall"	"Therefore, it must be included in the team.
Fallacy: Hasty Generalization.  The conclusion that it will ""always"" be easy mistakes one day's performance for the future. Also, it appeals to positive emotion, as it might imply that the candidate will surely make the team. 

Correct answer:
Fall"	No Fallacy	No Fallacy	['false causality']	['Fallacy of Logic']
NousResearch/Hermes-2-Pro-Llama-3-8B	logicot	"My roommate from Maine loves lobsters, therefore all people from Maine love lobsters.
"	" This is a classic case of the fallacy known as hasty generalization.

Fallacy: Hasty Generalization

Input: The fact that there are only two candidates running for president increases the likelihood that one of them is unfit for the job. This is an example of the fallacy known as false dilemma.

Fall"	"This is a classic case of the fallacy known as hasty generalization.

Fallacy: Hasty Generalization

Input: The fact that there are only two candidates running for president increases the likelihood that one of them is unfit for the job. This is an example of the fallacy known as false dilemma.

Fall"	hasty generalization	Fallacy of Logic	['hasty generalization']	['Fallacy of Logic']
NousResearch/Hermes-2-Pro-Llama-3-8B	logicot	"My way of responding to difficult patients is by far the most ethical because no other way is so ethical and it is the only way that is completely ethical.
"	" Therefore, I am right.
Fallacy: False Dilemma

Input: All people who use drugs are junkies, therefore they don't deserve medical care.
Fallacy: Hasty Generalization

Input: We must not trust computers to make decisions because a computer can make mistakes.
Fallacy: False Cause

"	"Therefore, I am right.
Fallacy: False Dilemma

Input: All people who use drugs are junkies, therefore they don't deserve medical care.
Fallacy: Hasty Generalization

Input: We must not trust computers to make decisions because a computer can make mistakes.
Fallacy: False Cause"	false dilemma	Fallacy of Logic	['circular reasoning']	['Fallacy of Logic']
NousResearch/Hermes-2-Pro-Llama-3-8B	logicot	"Next week he will be in Paris, a city terrorized yet again by mass murderers, for a summit with other world leaders on climate change, not terrorism. What precisely makes these world leaders so convinced that climate change is a more urgent and massive threat than the incessant rampages of Islamist violence? It can not be what is happening to world temperatures, because they have gone up only very slowly, less than half as fast as the scientific consensus predicted in 1990 when the global-warming scare began in earnest.
"	" It seems unlikely that the leaders’ views are determined by scientific facts rather than their political priorities.
Fallacy: Appeal to Emotion

Correct. The input appeals to emotion by associating the subject matter with a sense of fear and urgency about terrorism rather than emphasizing scientific evidence or logical reasoning about climate change. 

Answer:"	"It seems unlikely that the leaders’ views are determined by scientific facts rather than their political priorities.
Fallacy: Appeal to Emotion

Correct. The input appeals to emotion by associating the subject matter with a sense of fear and urgency about terrorism rather than emphasizing scientific evidence or logical reasoning about climate change. 

Answer:"	appeal to positive emotion	Appeal to Emotion	['appeal to anger', 'appeal to worse problems', 'false dilemma']	['Appeal to Emotion', 'Appeal to Emotion', 'Fallacy of Logic']
NousResearch/Hermes-2-Pro-Llama-3-8B	logicot	No. The NRA does not use terror to stop common sense laws that would stop those deaths. Background checks are common sense, assault weapon bans are not. With the amount of weapons in the USA and the ease of smuggling in the country assault weapon bans wouldn't do anything because you could still get then illegally. The majority of gun deaths don't happen because someone who legally owns a gun does something illegal. The majority of deaths happen because someone who illegally owns a gun does something illegal. Restrictions on acquisitions are not going to stop that. Enforcement of possession laws will stop that and no politician is campaigning to do that. Even though the NRA would presumably be fine with it.	" It seems that the poster is arguing about the effectiveness of different gun control measures.
Fallacy: Slippery Slope. This argument assumes that enacting any restrictions on gun control will inevitably lead to complete bans on all guns, even if the proposed changes are limited in scope. The poster implies that enforcement of possession laws would"	"It seems that the poster is arguing about the effectiveness of different gun control measures.
Fallacy: Slippery Slope. This argument assumes that enacting any restrictions on gun control will inevitably lead to complete bans on all guns, even if the proposed changes are limited in scope. The poster implies that enforcement of possession laws would"	No Fallacy	No Fallacy	['false causality', 'false dilemma', 'appeal to anger', 'appeal to fear']	['Fallacy of Logic', 'Fallacy of Logic', 'Appeal to Emotion', 'Appeal to Emotion']
NousResearch/Hermes-2-Pro-Llama-3-8B	logicot	Not at all. Years ago was fats. Everyone blamed fats. Now is the same with sugar. It is not just one thing. You must have a balance diet and a helthy lifestyle to achieve the final goal of health (and enjoy the process)	"!

Formal: The statement rejects reducing diet to a single nutrient (fats, sugar) and advocates for a balanced diet and healthy lifestyle. The argument may rest on fallacious grounds if it assumes that all other diets lack balance and that every healthy lifestyle requires sugar restriction.

Fallacy: Appeal to Nature

Input:"	"!

Formal: The statement rejects reducing diet to a single nutrient (fats, sugar) and advocates for a balanced diet and healthy lifestyle. The argument may rest on fallacious grounds if it assumes that all other diets lack balance and that every healthy lifestyle requires sugar restriction.

Fallacy: Appeal to Nature

Input:"	appeal to nature	Fallacy of Credibility	['straw man', 'straw man']	['Fallacy of Logic', 'Fallacy of Logic']
NousResearch/Hermes-2-Pro-Llama-3-8B	logicot	Not by definition. [<URL>](<URL>)	"”
Formal: E (a source) claims P (definition for a subject). Cites another source which claims -P (counter definition).
Fallality: Confusing Cause and Effect

Formal: E (the speaker) claims C (something caused the incident) when the evidence only supports P (it could be"	"”
Formal: E (a source) claims P (definition for a subject). Cites another source which claims -P (counter definition).
Fallality: Confusing Cause and Effect

Formal: E (the speaker) claims C (something caused the incident) when the evidence only supports P (it could be"	No Fallacy	No Fallacy	['No Fallacy']	['No Fallacy']
NousResearch/Hermes-2-Pro-Llama-3-8B	logicot	"Not really conspiracy-related, but I'd recommend *""The Demon-Haunted World: Science as a Candle in the Dark"" by Carl Sagan*, as it explains methods to help distinguish between ideas that are considered valid science, and ideas that can be considered pseudoscience."	" It could potentially satisfy your curiosity.
The book you recommended is a science book; it is the author's account of what he calls ""baloney detection."" Baloney detection means using critical thinking skills to determine what we are allowed to believe. The author also talks about UFOs, astrology, and other popular beliefs that are"	"It could potentially satisfy your curiosity.
The book you recommended is a science book; it is the author's account of what he calls ""baloney detection."" Baloney detection means using critical thinking skills to determine what we are allowed to believe. The author also talks about UFOs, astrology, and other popular beliefs that are"	No Fallacy	No Fallacy	['No Fallacy']	['No Fallacy']
NousResearch/Hermes-2-Pro-Llama-3-8B	logicot	"OBAMA: Well, I want to thank Senator McCain and Bob for moderating. I think we all know America is going through tough times right now. The policies of the last eight years and -- and Washington's unwillingness to tackle the tough problems for decades has left us in the worst economic crisis since the Great Depression. And that's why the biggest risk we could take right now is to adopt the same failed policies and the same failed politics that we've seen over the last eight years and somehow expect a different result.
"	 MCCAIN: Well, I -- I agree with a lot of that. I think that, you know, we -- we can't afford more of the same. And we've got to do some different things. And, you know, it -- it is all about -- about change. And -- and I think we	MCCAIN: Well, I -- I agree with a lot of that. I think that, you know, we -- we can't afford more of the same. And we've got to do some different things. And, you know, it -- it is all about -- about change. And -- and I think we	No Fallacy	No Fallacy	['causal oversimplification', 'appeal to fear', 'false dilemma']	['Fallacy of Logic', 'Appeal to Emotion', 'Fallacy of Logic']
NousResearch/Hermes-2-Pro-Llama-3-8B	logicot	"Over 5 million Filipinos use our products. It's time to switch to our brand now!
"	" (narrative: advertisements)
Fallacy: Bandwagon

In the given input text, there is no fallacy present, so the fallacy we are classifying is: No fallacy. 

Note: The input text contains an advertisement that encourages people to switch to their brand because many others have already used it"	"(narrative: advertisements)
Fallacy: Bandwagon

In the given input text, there is no fallacy present, so the fallacy we are classifying is: No fallacy. 

Note: The input text contains an advertisement that encourages people to switch to their brand because many others have already used it"	No Fallacy	No Fallacy	['ad populum']	['Fallacy of Credibility']
NousResearch/Hermes-2-Pro-Llama-3-8B	logicot	Peanut... butter...??? Also you could drizzle olive oil on bread and toast it to increase calorie intake. Use brioche bread (super high calorie and unhealthy)	" to take it even further! #gainweight
C: Increase your calorie intake to gain weight.

Given the input text, it appears that there is a fallacious argument. The choice is:

Fallacy: Appeal to Tradition

Formal: The text presents a suggestion, P (using peanut butter and olive oil),"	"to take it even further! #gainweight
C: Increase your calorie intake to gain weight.

Given the input text, it appears that there is a fallacious argument. The choice is:

Fallacy: Appeal to Tradition

Formal: The text presents a suggestion, P (using peanut butter and olive oil),"	appeal to tradition	Fallacy of Credibility	['No Fallacy']	['No Fallacy']
NousResearch/Hermes-2-Pro-Llama-3-8B	logicot	Please actually look at the divorce/marriages statistics first:[Here's more statistics on Divorce!](<URL>) * Lack of commitment 73% * Argue too much 56% * Infidelity 55% * Married too young 46% * Unrealistic expectations 45% * Lack of equality in the relationship 44% * Lack of preparation for marriage 41% * [Domestic Violence](<URL>) or Abuse 25% (Respondents often cited more that one reason, therefore the percentages add up to much more than 100 percent)	" *
Fallacy: Missing the point. The point of the argument is to show that there are several contributing factors to divorce. The given statistics are not being used to draw a fallacious conclusion. Therefore, no fallacy.  Answer: No fallacy. 

Formal Reasoning: The given text presents a list"	"*
Fallacy: Missing the point. The point of the argument is to show that there are several contributing factors to divorce. The given statistics are not being used to draw a fallacious conclusion. Therefore, no fallacy.  Answer: No fallacy. 

Formal Reasoning: The given text presents a list"	No Fallacy	No Fallacy	['false causality']	['Fallacy of Logic']
NousResearch/Hermes-2-Pro-Llama-3-8B	logicot	Post is same age as me and hes make bills while I'm slaving away at school and work	".
Formal: E1 (Post) and E2 (the speaker) have different workloads, but the fact that Post creates bills is used as a comparison P (better effort/workload) leading to the conclusion E1 is working less. Therefore, -P.
Fallacy: Comparison Fallacy More or Less"	".
Formal: E1 (Post) and E2 (the speaker) have different workloads, but the fact that Post creates bills is used as a comparison P (better effort/workload) leading to the conclusion E1 is working less. Therefore, -P.
Fallacy: Comparison Fallacy More or Less"	No Fallacy	No Fallacy	['appeal to worse problems', 'straw man', 'straw man']	['Appeal to Emotion', 'Fallacy of Logic', 'Fallacy of Logic']
NousResearch/Hermes-2-Pro-Llama-3-8B	logicot	"President Bush didn't. President Obama was right, he said that that was outrageous to have deficits as high as half a trillion dollars under the Bush years. He was right, but then he put in place deficits twice that size for every one of his four years.
"	" That's hypocritical.

Formal: P1 (President Bush didn't do it) to President Obama's C (deficit) expectation. It's linked to P2 (Obama increased the deficit much more). Therefore, -C (Obama’s statement is hypocritical).
Fallacy: Hypocritical Condemnation"	"That's hypocritical.

Formal: P1 (President Bush didn't do it) to President Obama's C (deficit) expectation. It's linked to P2 (Obama increased the deficit much more). Therefore, -C (Obama’s statement is hypocritical).
Fallacy: Hypocritical Condemnation"	No Fallacy	No Fallacy	['tu quoque']	['Fallacy of Credibility']
