Model	Technique	Input	Output	Cleared_output	Extracted Label	Extracted Superlabel	True Label	True Superlabel
NousResearch/Hermes-2-Pro-Llama-3-8B	logicot	"Punitive: inflicting punishment, punishing Seems about right. Fines are punishments. Calling a fine""punitive"" is like calling a textbook""educational"". The gov't has been going all out to educate people. Anyone who still doesn't know the rules by now just isn't bothering to educate themselves."	" You could call it punishing or you could call it sending a bill for the mistakes that were made. But you cannot ignore the fact that this is a result of a lawbreaker's bad choices.

Fallacy: Appeal to Nature
Reasoning: The argument compares a punitive fine to a textbook being educational. This comparison is"	"You could call it punishing or you could call it sending a bill for the mistakes that were made. But you cannot ignore the fact that this is a result of a lawbreaker's bad choices.

Fallacy: Appeal to Nature
Reasoning: The argument compares a punitive fine to a textbook being educational. This comparison is"	appeal to nature	Fallacy of Credibility	['Appeal to Ridicule', 'ad hominem']	['Appeal to Emotion', 'Fallacy of Credibility']
NousResearch/Hermes-2-Pro-Llama-3-8B	logicot	"Reading everyone's comments has made me change my opinion on having an adventure mode like thing in PoE. I keep seeing if an adventure mode needs to exist then why not just start a char at 68. then a couple months after that we'll see post about how people want to start at 90 just so they can kill bosses. Then a few months later we'll see people asking for a""creative"" mode so they can have access to all items in the game so they don't have to farm, and i dont think that sets a good example as a community for a game that we all love."	" I don't want PoE to end up like WoW
Fallacy: Slippery Slope

Formal: If we add an adventure mode (P1), then eventually gamers might want to start at higher levels (P2). Eventually, some may even want a “creative” mode with all items available, which"	"I don't want PoE to end up like WoW
Fallacy: Slippery Slope

Formal: If we add an adventure mode (P1), then eventually gamers might want to start at higher levels (P2). Eventually, some may even want a “creative” mode with all items available, which"	slippery slope	Fallacy of Logic	['slippery slope']	['Fallacy of Logic']
NousResearch/Hermes-2-Pro-Llama-3-8B	logicot	Refusing to acknowledge that you made a mistake and making excuses instead of being better. We're human. We're flawed - all of us.	" It's the mistakes we learn from that make us better.

Given the input text, the claim is that one should acknowledge their mistakes for personal growth. If individuals don't acknowledge their errors and apologize, it will hinder their potential for self-improvement.

This argument lacks evidence and is unsound. It suggests that making"	"It's the mistakes we learn from that make us better.

Given the input text, the claim is that one should acknowledge their mistakes for personal growth. If individuals don't acknowledge their errors and apologize, it will hinder their potential for self-improvement.

This argument lacks evidence and is unsound. It suggests that making"	No Fallacy	No Fallacy	['No Fallacy']	['No Fallacy']
NousResearch/Hermes-2-Pro-Llama-3-8B	logicot	Rightly so. I don't care how it makes trans people feel, the vast majority of people would want to know if someone was born a different sex to that which they're passing themselves off as.	" It's just wrong. 

Formal: P1 (a person might feel uncomfortable knowing someone was born a different sex). P2 (most people would want to know). Therefore, C (the practice is wrong).
Fallacy: Appeal to Popularity

Choose exactly one fallacy from the list above. The correct"	"It's just wrong. 

Formal: P1 (a person might feel uncomfortable knowing someone was born a different sex). P2 (most people would want to know). Therefore, C (the practice is wrong).
Fallacy: Appeal to Popularity

Choose exactly one fallacy from the list above. The correct"	appeal to pity	Appeal to Emotion	['ad populum']	['Fallacy of Credibility']
NousResearch/Hermes-2-Pro-Llama-3-8B	logicot	"Sam is riding her bike in her home town in Maine, minding her own business. A station wagon comes up behind her and the driver starts beeping his horn and then tries to force her off the road. As he goes by, the driver yells""get on the sidewalk where you belong!"" Sam sees that the car has Ohio plates and concludes that all Ohio drivers are jerks.
"	" Sam is committing the fallacy of Hasty Generalization.
Fallacy: Hasty Generalization

Formal: E (Sam) has a specific experience with one OH driver (the rude behavior) and generalizes it over all Ohio drivers, concluding that all drivers from Ohio are the same.

Fallacy: Hasty"	"Sam is committing the fallacy of Hasty Generalization.
Fallacy: Hasty Generalization

Formal: E (Sam) has a specific experience with one OH driver (the rude behavior) and generalizes it over all Ohio drivers, concluding that all drivers from Ohio are the same.

Fallacy: Hasty"	hasty generalization	Fallacy of Logic	['hasty generalization']	['Fallacy of Logic']
NousResearch/Hermes-2-Pro-Llama-3-8B	logicot	"Several years ago, a group of 10 psychologists started a psychology training program. Each of those psychologists is efficient, effective, and highly-regarded. Their training program must be efficient, effective, and highly-regarded.
"	" (Note: this is not my argument, but a hypothetical one.)

C = conclusion

Formal: E (10 efficient, effective, highly-regarded psychologists) have started a psychology training program. Therefore, the training program is efficient, effective, and highly-regarded.
Fallacy: Hasty Generalization

Answer"	"(Note: this is not my argument, but a hypothetical one.)

C = conclusion

Formal: E (10 efficient, effective, highly-regarded psychologists) have started a psychology training program. Therefore, the training program is efficient, effective, and highly-regarded.
Fallacy: Hasty Generalization

Answer"	hasty generalization	Fallacy of Logic	['causal oversimplification', 'false analogy']	['Fallacy of Logic', 'Fallacy of Logic']
NousResearch/Hermes-2-Pro-Llama-3-8B	logicot	"Slavery is accepted by just about everyone in our society, so it's ethical to keep slaves.
"	" I mean, what's the big deal?
Fallacy: False Appeal to Consensus

Formal:
E (slavery) is acceptable according to many people in society. Therefore, E (slavery) is considered to be ethical and not a major issue.
Fallacy: False Consensus
``` sql
SELECT"	"I mean, what's the big deal?
Fallacy: False Appeal to Consensus

Formal:
E (slavery) is acceptable according to many people in society. Therefore, E (slavery) is considered to be ethical and not a major issue.
Fallacy: False Consensus
``` sql
SELECT"	No Fallacy	No Fallacy	['ad populum']	['Fallacy of Credibility']
NousResearch/Hermes-2-Pro-Llama-3-8B	logicot	So a woman got in an altercation, got mad and grabbed a gun and starting shooting, and was then shot by someone else.	" The problem seems to not be people owning guns... the real problem is people being mad.
Fallacy: False Cause
Formal Reasoning: The input text suggests that the act of owning a gun and the act of being mad are both causes for the violence in this case. The conclusion drawn, however, implies that"	"The problem seems to not be people owning guns... the real problem is people being mad.
Fallacy: False Cause
Formal Reasoning: The input text suggests that the act of owning a gun and the act of being mad are both causes for the violence in this case. The conclusion drawn, however, implies that"	false causality	Fallacy of Logic	['No Fallacy']	['No Fallacy']
NousResearch/Hermes-2-Pro-Llama-3-8B	logicot	So freaking true...I recently got a $100k+ job without a college degree, before my 30th birthday. I did it because I worked my ass off and learned a skill in the military. It's not that hard you just got to do the best you can.	" Keep pushing forward and eventually you'll get there. It's really not that complicated.
Fallacy: Slippery Slope

Formal: P1 (work hard and learn a valuable skill) leads to P2 (obtain a $100k+ job), implying that success is easy if you just keep pushing forward"	"Keep pushing forward and eventually you'll get there. It's really not that complicated.
Fallacy: Slippery Slope

Formal: P1 (work hard and learn a valuable skill) leads to P2 (obtain a $100k+ job), implying that success is easy if you just keep pushing forward"	slippery slope	Fallacy of Logic	['causal oversimplification', 'hasty generalization']	['Fallacy of Logic', 'Fallacy of Logic']
NousResearch/Hermes-2-Pro-Llama-3-8B	logicot	So he's saying liberals are better educated than conservatives. We agree. Trump isn't the only one who loves the poorly educated.	" He's just more honest about it.
Formal: The speaker agrees with a claim (liberals are better educated than conservatives) and uses a sarcastic tone to say that Trump admires the poorly educated. Therefore, the claim is accepted.
Fallacy:Sarcasm


Input:The FDA didn't approve it,"	"He's just more honest about it.
Formal: The speaker agrees with a claim (liberals are better educated than conservatives) and uses a sarcastic tone to say that Trump admires the poorly educated. Therefore, the claim is accepted.
Fallacy:Sarcasm


Input:The FDA didn't approve it,"	No Fallacy	No Fallacy	['Appeal to Ridicule', 'equivocation', 'straw man', 'hasty generalization', 'ad hominem']	['Appeal to Emotion', 'Fallacy of Logic', 'Fallacy of Logic', 'Fallacy of Logic', 'Fallacy of Credibility']
NousResearch/Hermes-2-Pro-Llama-3-8B	logicot	"So if it was advertised with the 1080p screen, but doesn't have that, you could get a refund and return it - ""not as described"" - or, contact the vendor and negotiate a rebate."	" 
Fallacy: None

Formal: P1 (1080p screen is advertised) but not present in the product which leads to C (""not as described""). Hence, P2 (customer is eligible for a refund or rebate). No fallacy.

Formal: P (the candidate is friendly) supports C"	"Fallacy: None

Formal: P1 (1080p screen is advertised) but not present in the product which leads to C (""not as described""). Hence, P2 (customer is eligible for a refund or rebate). No fallacy.

Formal: P (the candidate is friendly) supports C"	No Fallacy	No Fallacy	['No Fallacy']	['No Fallacy']
NousResearch/Hermes-2-Pro-Llama-3-8B	logicot	So much important stuff in the world that needs political activism. Makes a petition to portbeg P5 onto PC and Switch.	" Why aren’t these petitions getting more signatures? People are so self-centered.
Fallacy: Appeal to Anger

Explanation: The input includes a negative comment about people not showing support for a petition through signing it, framing them as'self-centered'. This kind of statement usually tries to evoke a sense of anger or frustration"	"Why aren’t these petitions getting more signatures? People are so self-centered.
Fallacy: Appeal to Anger

Explanation: The input includes a negative comment about people not showing support for a petition through signing it, framing them as'self-centered'. This kind of statement usually tries to evoke a sense of anger or frustration"	appeal to anger	Appeal to Emotion	['Appeal to Ridicule', 'appeal to worse problems']	['Appeal to Emotion', 'Appeal to Emotion']
NousResearch/Hermes-2-Pro-Llama-3-8B	logicot	So now the far left is going to have to admit that there is a difference between the brains of men and women and their behavior isn't just a social construct that is created by what toys they are raised with? Looks like the exception is charging to the rescue of the norm. Plot twist!	" Fallacy: Ad Hominem
The given argument seems to be attacking the entities involved (far left, brains of men and women) and the argument does not contain a true factual premise, nor does it propose a logical conclusion. It can be classified as an Ad Hominem fallacy, which occurs when an"	"Fallacy: Ad Hominem
The given argument seems to be attacking the entities involved (far left, brains of men and women) and the argument does not contain a true factual premise, nor does it propose a logical conclusion. It can be classified as an Ad Hominem fallacy, which occurs when an"	ad hominem	Fallacy of Credibility	['straw man', 'hasty generalization']	['Fallacy of Logic', 'Fallacy of Logic']
NousResearch/Hermes-2-Pro-Llama-3-8B	logicot	"So the least corrupt state is anarchy by this logic. This is""deep"" libertarian bullshit. Yes, over regulation is a thing, but laws against theft, murder, slavery, child labor, education, etc. are good things - not corruption."	" 

Formal: An argument claims that without any laws (anarchy), a state would be the least corrupt. The counter-argument states that laws against theft, murder, slavery, etc., although they can be overregulated, are necessary and good, and hence, anarchy would not be the least corrupt state.
"	Formal: An argument claims that without any laws (anarchy), a state would be the least corrupt. The counter-argument states that laws against theft, murder, slavery, etc., although they can be overregulated, are necessary and good, and hence, anarchy would not be the least corrupt state.	No Fallacy	No Fallacy	['Appeal to Ridicule', 'equivocation', 'ad hominem', 'guilt by association', 'circular reasoning', 'false dilemma']	['Appeal to Emotion', 'Fallacy of Logic', 'Fallacy of Credibility', 'Fallacy of Credibility', 'Fallacy of Logic', 'Fallacy of Logic']
NousResearch/Hermes-2-Pro-Llama-3-8B	logicot	So was the bar burned by a mob and the owner killed? If not, Christians have a ways to go before they are on par with Muslims.	" So, given that Islam preaches peace, why are its followers prone to such violence?
Fallacy: False Analogy

Explanation: The comparison between Christians and Muslims in this context is an unfair and misleading analogy. It assumes that both groups should have similar levels of violence, which isn't a valid basis for comparison."	"So, given that Islam preaches peace, why are its followers prone to such violence?
Fallacy: False Analogy

Explanation: The comparison between Christians and Muslims in this context is an unfair and misleading analogy. It assumes that both groups should have similar levels of violence, which isn't a valid basis for comparison."	false analogy	Fallacy of Logic	['false dilemma', 'hasty generalization']	['Fallacy of Logic', 'Fallacy of Logic']
NousResearch/Hermes-2-Pro-Llama-3-8B	logicot	So what would be the down side of this? I'm just curious if someone could tell me that would be great.	" 
Classification: No fallacy

Input: The government has proposed a major increase in the minimum wage. However, this would lead to companies either having to raise their product prices or lay off employees to compensate for the increased labor costs. Additionally, companies may also choose to move operations overseas where labor is cheaper. 
Classification"	"Classification: No fallacy

Input: The government has proposed a major increase in the minimum wage. However, this would lead to companies either having to raise their product prices or lay off employees to compensate for the increased labor costs. Additionally, companies may also choose to move operations overseas where labor is cheaper. 
Classification"	No Fallacy	No Fallacy	['appeal to fear']	['Appeal to Emotion']
NousResearch/Hermes-2-Pro-Llama-3-8B	logicot	Social media is the worst. People don't realize how much of an effect it has on someone, especially his generation. Anyone in the public eye who has any sort of mental health issue should rid themselves of their accounts if they possibly can. I understand studios force some actors to be active there, but if it's the difference between leading a happy, healthy life or getting a movie role, it really should be an easy decision.	" I think it really needs to be a wake-up call, especially after what happened with Chris Cornell and Chester Bennington. What happened to both of them is a tragic, unnecessary loss of life. I don't think people are making the connection that being active on social media could play a part in it.

The given"	"I think it really needs to be a wake-up call, especially after what happened with Chris Cornell and Chester Bennington. What happened to both of them is a tragic, unnecessary loss of life. I don't think people are making the connection that being active on social media could play a part in it.

The given"	No Fallacy	No Fallacy	['hasty generalization', 'false dilemma', 'appeal to worse problems']	['Fallacy of Logic', 'Fallacy of Logic', 'Appeal to Emotion']
NousResearch/Hermes-2-Pro-Llama-3-8B	logicot	"Someone once told me they have an""alt"" cause their main account was too high of rank to play with their friends. It's exactly the same as smurfing."	" Smurfing is when people make new accounts just so they can play with their friends at a lower rank.

Given the input text, classify if it contains a fallacious argument.
Fallacy: Appeal to Authority
Formal: An unspecified individual claims P (having an ""alt"" account makes it easier to play with"	"Smurfing is when people make new accounts just so they can play with their friends at a lower rank.

Given the input text, classify if it contains a fallacious argument.
Fallacy: Appeal to Authority
Formal: An unspecified individual claims P (having an ""alt"" account makes it easier to play with"	appeal to false authority	Fallacy of Credibility	['false analogy']	['Fallacy of Logic']
NousResearch/Hermes-2-Pro-Llama-3-8B	logicot	"The Freehold Raceway Mall is the best mall because there are always so many cars there.
"	" This shows that it is popular and gets a lot of traffic.

Formal: P1 (many cars at the Freehold Raceway Mall) and P2 (popularity and traffic are indicators of mall value), leading to P (the Freehold Raceway Mall is the best mall). 
Fallacy: Wrong
"	"This shows that it is popular and gets a lot of traffic.

Formal: P1 (many cars at the Freehold Raceway Mall) and P2 (popularity and traffic are indicators of mall value), leading to P (the Freehold Raceway Mall is the best mall). 
Fallacy: Wrong"	No Fallacy	No Fallacy	['causal oversimplification']	['Fallacy of Logic']
NousResearch/Hermes-2-Pro-Llama-3-8B	logicot	"The United States is the wealthiest nation in the world. So every American is wealthy.
"	" Fallacy: False Dilemma. 

Input: The average American spends more money on coffee than any other country in the world. Therefore, coffee shops must be doing well in the United States. Fallacy: Hasty Generalization.

Input: It's raining outside, so obviously it's too cold to go for"	"Fallacy: False Dilemma. 

Input: The average American spends more money on coffee than any other country in the world. Therefore, coffee shops must be doing well in the United States. Fallacy: Hasty Generalization.

Input: It's raining outside, so obviously it's too cold to go for"	No Fallacy	No Fallacy	['fallacy of division']	['Fallacy of Logic']
NousResearch/Hermes-2-Pro-Llama-3-8B	logicot	The bible is not Clear it's clear enough so that there are 2.18 billion Christians A comprehensive demographic study of more than 200 countries finds that there are 2.18 billion Christians of all ages around the world, representing nearly a third of the estimated 2010 global population of 6.9 billion. <URL>	" The bible is clear enough to create a world religion. It's success speaks for itself
Fallacy: Fallacy of Begging the Question

Formal:
P (the bible is clear enough) is assumed in the argument that leads to the conclusion -C (there are 2.18 billion Christians).
Fallacy"	"The bible is clear enough to create a world religion. It's success speaks for itself
Fallacy: Fallacy of Begging the Question

Formal:
P (the bible is clear enough) is assumed in the argument that leads to the conclusion -C (there are 2.18 billion Christians).
Fallacy"	No Fallacy	No Fallacy	['ad populum']	['Fallacy of Credibility']
NousResearch/Hermes-2-Pro-Llama-3-8B	logicot	The drunk guy I agree with, however the other two are perfectly fine. Most states have laws against carry while drinking. Someone choosing to open carry an AR isnt subject to your approval. They dont need you to think their are cool to exercise a right. 14 year olds are plenty old enough to be around loaded guns. They arent 4. I had guns in a safe in my bedroom from 10 years old. I had the key and ammo. Again, someone else's rights arent based on your approval.	" 
Fallacy: False Dilemma
Fallacy: Slippery Slope
Fallacy: Appeal to False Authority

Formal:
P1 (littering) is compared to P2 (global warming), which is a worse problem, leading to the conclusion that P1 is not important.
Fallacy:"	"Fallacy: False Dilemma
Fallacy: Slippery Slope
Fallacy: Appeal to False Authority

Formal:
P1 (littering) is compared to P2 (global warming), which is a worse problem, leading to the conclusion that P1 is not important.
Fallacy:"	false dilemma	Fallacy of Logic	['hasty generalization', 'ad populum', 'Appeal to Ridicule']	['Fallacy of Logic', 'Fallacy of Credibility', 'Appeal to Emotion']
NousResearch/Hermes-2-Pro-Llama-3-8B	logicot	"The last Democrat winner of the New Hampshire primary won the general election. This year, the winner of the New Hampshire primary will win the general election.
"	" Fallacy: 
Appeal to Habit

OR

Formal: E1 (the last Democrat winner of New Hampshire primary) had property P (won the general election). E2 (this year’s Democrat winner of the New Hampshire primary) is similar to E1 in terms of property P.
Fallacy: Appeal"	"Fallacy: 
Appeal to Habit

OR

Formal: E1 (the last Democrat winner of New Hampshire primary) had property P (won the general election). E2 (this year’s Democrat winner of the New Hampshire primary) is similar to E1 in terms of property P.
Fallacy: Appeal"	No Fallacy	No Fallacy	['causal oversimplification', 'false causality']	['Fallacy of Logic', 'Fallacy of Logic']
NousResearch/Hermes-2-Pro-Llama-3-8B	logicot	The mustard thing really drives me crazy because he was at a deli. He wasn't at some persons house calling them trash when they didn't have his preferred condiment, they're supposed to have that stuff. It's like getting mad at someone when they ask for marinara at a pizza joint.	" I mean, c'mon. He just needs to get over it.
Output:Fallacy: Ad Hominem

Explanation: In the argument, instead of addressing the issue at hand (liking or disliking mustard), the attacker tries to undermine the other person's character by relating it to a trivial matter"	"I mean, c'mon. He just needs to get over it.
Output:Fallacy: Ad Hominem

Explanation: In the argument, instead of addressing the issue at hand (liking or disliking mustard), the attacker tries to undermine the other person's character by relating it to a trivial matter"	ad hominem	Fallacy of Credibility	['No Fallacy']	['No Fallacy']
NousResearch/Hermes-2-Pro-Llama-3-8B	logicot	"The president of Honduras is a good leader because he is a leader of the country.
"	" Formal: E (president of Honduras) has the property P1 (being a leader), leading to conclusion P2 (is a good leader).
Fallacy: Fallacy of Ambiguity

Answer: Fallacy of Ambiguity
Explanation: In this case, the logic does not hold because it confuses"	"Formal: E (president of Honduras) has the property P1 (being a leader), leading to conclusion P2 (is a good leader).
Fallacy: Fallacy of Ambiguity

Answer: Fallacy of Ambiguity
Explanation: In this case, the logic does not hold because it confuses"	No Fallacy	No Fallacy	['circular reasoning']	['Fallacy of Logic']
NousResearch/Hermes-2-Pro-Llama-3-8B	logicot	"The sea-ice loss is President Vladimir Putin' s gain. Already the largest country on the planet, Russia stands to gain access to shipping routes and energy reserves, and a strategic military advantage from the opening of the Arctic. Along the Russian coastline, which makes up more than half the Arctic total, winds and currents push old ice away from potential shipping lanes and prevent the build-up of thicker, multi-year ice that would leave other parts of the Arctic impassable for longer periods.
"	" In this manner,  the disappearance of the polar ice cap plays into the hands of the Russian navy.
Fallacy: Ad Hominem

The given text presents a Fallacious Argument called Ad Hominem. This occurs when the attacking the character or motive of a speaker or argument is used to dismiss or weaken the"	"In this manner,  the disappearance of the polar ice cap plays into the hands of the Russian navy.
Fallacy: Ad Hominem

The given text presents a Fallacious Argument called Ad Hominem. This occurs when the attacking the character or motive of a speaker or argument is used to dismiss or weaken the"	ad hominem	Fallacy of Credibility	['No Fallacy']	['No Fallacy']
NousResearch/Hermes-2-Pro-Llama-3-8B	logicot	"The spider that bit was poison, therefore all spiders are poison.
"	" Fallacy: Hasty Generalization.

The fallacious premise can be represented with the following formal structure:

Premise: E (the spider that bit) has attribute P (poison).
Conclusion: All E1 (spiders) have attribute P (poison).

In this scenario, we are inferring a specific"	"Fallacy: Hasty Generalization.

The fallacious premise can be represented with the following formal structure:

Premise: E (the spider that bit) has attribute P (poison).
Conclusion: All E1 (spiders) have attribute P (poison).

In this scenario, we are inferring a specific"	No Fallacy	No Fallacy	['hasty generalization']	['Fallacy of Logic']
